{
  "schema_version": 1,
  "tool": {
    "name": "kvcbom",
    "version": "1.0.0-test",
    "commit": "testcommit",
    "date": "2026-01-01"
  },
  "generated_at": "2026-01-01T00:00:00Z",
  "title": "Test Readiness Report",
  "assessment": {
    "organisation": "Example Corp",
    "assessor": "Sec Team",
    "scope": "Web tier"
  },
  "pack": {
    "id": "baseline-pqc",
    "version": "1.0.0",
    "status": "final",
    "sha256": "test-pack-sha",
    "unverified_content": false
  },
  "inputs": [
    {
      "file": "bom.json",
      "sha256": "sha-of-bom"
    }
  ],
  "warnings": {
    "unverified_rule_content": false,
    "low_confidence_finding_count": 2,
    "low_confidence_finding_share": 0.5,
    "messages": [
      "2 finding(s) rest on low-confidence evidence (C1/C2) and are marked as requiring verification",
      "1 asset(s) could not be classified from the available data"
    ]
  },
  "summary": {
    "total_assets": 4,
    "total_findings": 4,
    "findings_by_severity": [
      {
        "key": "critical",
        "count": 1
      },
      {
        "key": "high",
        "count": 1
      },
      {
        "key": "info",
        "count": 2
      }
    ],
    "top_risks": [
      {
        "asset_id": "0114ca6a0423d2f7",
        "name": "RSA-2048",
        "quantum_status": "shor_broken",
        "final_score": 0.9500000000000001,
        "hndl": true
      },
      {
        "asset_id": "b16e3233656248bb",
        "name": "SHA-1",
        "quantum_status": "classically_broken",
        "final_score": 0.6000000000000001,
        "hndl": false
      },
      {
        "asset_id": "8cfcafe97b4afde8",
        "name": "AES-256-GCM",
        "quantum_status": "quantum_resistant",
        "final_score": 0.2750000000000001,
        "hndl": false
      },
      {
        "asset_id": "0192dc1aa20f75c3",
        "name": "TLS 1.3",
        "quantum_status": "unknown",
        "final_score": 0.24500000000000002,
        "hndl": false
      }
    ],
    "hndl_asset_count": 1,
    "mosca_by_scenario": [
      {
        "scenario": "central",
        "years_until_crqc": 8,
        "exposed_assets": 1,
        "hndl_assets": 1
      },
      {
        "scenario": "pessimistic",
        "years_until_crqc": 5,
        "exposed_assets": 1,
        "hndl_assets": 1
      }
    ]
  },
  "inventory": {
    "by_type": [
      {
        "key": "algorithm",
        "count": 3
      },
      {
        "key": "protocol",
        "count": 1
      }
    ],
    "by_quantum_status": [
      {
        "key": "classically_broken",
        "count": 1
      },
      {
        "key": "quantum_resistant",
        "count": 1
      },
      {
        "key": "shor_broken",
        "count": 1
      },
      {
        "key": "unknown",
        "count": 1
      }
    ],
    "by_evidence_confidence": [
      {
        "key": "C1",
        "count": 1
      },
      {
        "key": "C2",
        "count": 1
      },
      {
        "key": "C3",
        "count": 1
      },
      {
        "key": "C4",
        "count": 1
      }
    ],
    "by_system": [
      {
        "key": "(unlinked)",
        "count": 2
      },
      {
        "key": "web",
        "count": 2
      }
    ]
  },
  "assets": [
    {
      "asset": {
        "id": "0114ca6a0423d2f7",
        "type": "algorithm",
        "name": "RSA-2048",
        "primitive": "pke",
        "oid": "1.2.840.113549.1.1.1",
        "system_refs": [
          "web"
        ],
        "data_class_refs": [
          "pii"
        ],
        "evidence": [
          {
            "source_type": "scanner-cbom",
            "source_file": "bom.json",
            "bom_ref": "alg:rsa",
            "confidence": 2
          }
        ]
      },
      "classified": true,
      "classification": {
        "status": "shor_broken",
        "entry_id": "rsa",
        "matched_by": [
          "oid"
        ],
        "source_id": "shor-1997",
        "rationale": "RSA security rests on integer factorisation, which Shor's algorithm solves in polynomial time on a CRQC.",
        "pack_id": "baseline-pqc",
        "pack_version": "1.0.0"
      },
      "score": {
        "quantum_vulnerability": 1,
        "mosca_exposure": [
          {
            "scenario": "central",
            "x_confidentiality_lifetime_years": 12,
            "y_migration_time_years": 4,
            "z_years_until_crqc": 8,
            "exposed": true,
            "hndl": true
          },
          {
            "scenario": "pessimistic",
            "x_confidentiality_lifetime_years": 12,
            "y_migration_time_years": 4,
            "z_years_until_crqc": 5,
            "exposed": true,
            "hndl": true
          }
        ],
        "mosca_score": 1,
        "criticality": 1,
        "evidence_confidence": 0.5,
        "hndl": true,
        "final": 0.9500000000000001,
        "weights": {
          "quantum_vulnerability": 0.4,
          "mosca_exposure": 0.3,
          "criticality": 0.2,
          "evidence_confidence": 0.1
        }
      }
    },
    {
      "asset": {
        "id": "0192dc1aa20f75c3",
        "type": "protocol",
        "name": "TLS 1.3",
        "evidence": [
          {
            "source_type": "scanner-cbom",
            "source_file": "bom.json",
            "bom_ref": "proto:tls",
            "confidence": 1
          }
        ]
      },
      "classified": false,
      "classification": {
        "status": "unknown",
        "pack_id": "baseline-pqc",
        "pack_version": "1.0.0"
      },
      "score": {
        "quantum_vulnerability": 0.3,
        "mosca_score": 0,
        "criticality": 0.5,
        "evidence_confidence": 0.25,
        "hndl": false,
        "final": 0.24500000000000002,
        "weights": {
          "quantum_vulnerability": 0.4,
          "mosca_exposure": 0.3,
          "criticality": 0.2,
          "evidence_confidence": 0.1
        },
        "notes": [
          "no linked system; criticality defaulted to medium",
          "no linked data class; Mosca exposure not computed"
        ]
      }
    },
    {
      "asset": {
        "id": "8cfcafe97b4afde8",
        "type": "algorithm",
        "name": "AES-256-GCM",
        "primitive": "ae",
        "system_refs": [
          "web"
        ],
        "data_class_refs": [
          "pii"
        ],
        "evidence": [
          {
            "source_type": "scanner-cbom",
            "source_file": "bom.json",
            "bom_ref": "alg:aes",
            "confidence": 3
          }
        ]
      },
      "classified": true,
      "classification": {
        "status": "quantum_resistant",
        "entry_id": "aes-256",
        "matched_by": [
          "name"
        ],
        "source_id": "grover-1996",
        "rationale": "AES-256 retains ~128 bits of security under Grover's algorithm.",
        "pack_id": "baseline-pqc",
        "pack_version": "1.0.0"
      },
      "score": {
        "quantum_vulnerability": 0,
        "mosca_exposure": [
          {
            "scenario": "central",
            "x_confidentiality_lifetime_years": 12,
            "y_migration_time_years": 4,
            "z_years_until_crqc": 8,
            "exposed": false,
            "hndl": false
          },
          {
            "scenario": "pessimistic",
            "x_confidentiality_lifetime_years": 12,
            "y_migration_time_years": 4,
            "z_years_until_crqc": 5,
            "exposed": false,
            "hndl": false
          }
        ],
        "mosca_score": 0,
        "criticality": 1,
        "evidence_confidence": 0.75,
        "hndl": false,
        "final": 0.2750000000000001,
        "weights": {
          "quantum_vulnerability": 0.4,
          "mosca_exposure": 0.3,
          "criticality": 0.2,
          "evidence_confidence": 0.1
        }
      }
    },
    {
      "asset": {
        "id": "b16e3233656248bb",
        "type": "algorithm",
        "name": "SHA-1",
        "primitive": "hash",
        "evidence": [
          {
            "source_type": "scanner-cbom",
            "source_file": "bom.json",
            "bom_ref": "alg:sha1",
            "confidence": 4
          }
        ]
      },
      "classified": true,
      "classification": {
        "status": "classically_broken",
        "entry_id": "sha1",
        "matched_by": [
          "name"
        ],
        "source_id": "shattered-2017",
        "rationale": "SHA-1 is collision-broken (SHAttered) and disallowed by NIST SP 800-131A.",
        "pack_id": "baseline-pqc",
        "pack_version": "1.0.0"
      },
      "score": {
        "quantum_vulnerability": 1,
        "mosca_score": 0,
        "criticality": 0.5,
        "evidence_confidence": 1,
        "hndl": false,
        "final": 0.6000000000000001,
        "weights": {
          "quantum_vulnerability": 0.4,
          "mosca_exposure": 0.3,
          "criticality": 0.2,
          "evidence_confidence": 0.1
        },
        "notes": [
          "no linked system; criticality defaulted to medium",
          "no linked data class; Mosca exposure not computed"
        ]
      }
    }
  ],
  "findings": [
    {
      "rule_id": "BLP-ASYM-SHOR",
      "finding_type": "quantum-vulnerable-asymmetric",
      "severity": "critical",
      "asset_id": "0114ca6a0423d2f7",
      "title": "Public-key algorithm broken by Shor's algorithm",
      "explanation": "This asset uses a public-key algorithm whose security rests on factoring or discrete logarithms, both solved efficiently by Shor's algorithm on a cryptographically relevant quantum computer. Data protected by it is exposed to harvest-now-decrypt-later capture.\n",
      "remediation_ref": "migrate-asymmetric-to-pqc",
      "evidence_refs": [
        "bom.json#alg:rsa"
      ],
      "requires_verification": true
    },
    {
      "rule_id": "BLP-CLASSIC-BROKEN",
      "finding_type": "classically-broken-primitive",
      "severity": "high",
      "asset_id": "b16e3233656248bb",